{
  "budget": {
    "max_external_queries": 0,
    "max_steps": 5,
    "used_external_queries": 0,
    "used_steps": 2
  },
  "domain": {
    "expanded_codes": [
      {
        "code": "msc2020:03E20",
        "reason": "manual",
        "weight": 1.0
      }
    ],
    "input_codes": [
      "msc2020:03E20"
    ]
  },
  "problem_slug": "demo_problem",
  "run_id": "sample_run_001",
  "schema": "leanatlas.retrieval_trace",
  "schema_version": "0.3.0",
  "steps": [
    {
      "action": {
        "code": "TRY_CODE_ACTIONS",
        "family": "SUGGEST",
        "standard": true
      },
      "candidates": [],
      "chosen": null,
      "error": null,
      "imports_added": [],
      "layer": "ENVIRONMENT",
      "query": null,
      "result": "MISS",
      "step_index": 0
    },
    {
      "action": {
        "code": "LOCAL_SEARCH",
        "family": "SEARCH",
        "standard": true
      },
      "candidates": [
        {
          "name": "Function.Injective.hasLeftInverse"
        }
      ],
      "chosen": {
        "name": "Function.Injective.hasLeftInverse"
      },
      "error": null,
      "imports_added": [
        "Mathlib.Logic.Function.Basic"
      ],
      "layer": "MATHLIB_SAME_DOMAIN",
      "query": "hasLeftInverse",
      "result": "HIT",
      "step_index": 1
    }
  ]
}
