{
  "budget": {
    "max_external_queries": 0,
    "max_steps": 0,
    "used_external_queries": 0,
    "used_steps": 0
  },
  "domain": {
    "expanded_codes": [],
    "input_codes": []
  },
  "problem_slug": "p",
  "run_id": "pos_trace_min",
  "schema": "leanatlas.retrieval_trace",
  "schema_version": "0.3.0",
  "steps": []
}
