{
  "budget": {
    "max_external_queries": 5,
    "max_steps": 50,
    "used_external_queries": 0,
    "used_steps": 0
  },
  "domain": {
    "expanded_codes": [],
    "input_codes": []
  },
  "problem_slug": "demo_problem",
  "run_id": "sample_run_002",
  "schema": "leanatlas.retrieval_trace",
  "schema_version": "0.4.0",
  "steps": []
}
